<?xml version="1.0" encoding="utf-8"?>
<SOP xmlns:xsi="http://www.w3.org/2001/XMLSchema-instance" xsi:noNamespaceSchemaLocation="http://unes.iptime.org:9808/SOP/XML/SOP.xsd">
  <Header>
    <XMLVersion>V1.4</XMLVersion>
    <Category>UnE</Category>
    <SubCategory>SOP</SubCategory>
    <Disaster>강간형</Disaster>
    <Regular>0</Regular>
    <Normal>1</Normal>
    <SOPVersion>공통_기본형1</SOPVersion>
  </Header>
  <Body>
    <ActionStepList>
      <ActionStep id="1" selected="1">
        <StepName>새시나리오</StepName>
        <PeriodType>0</PeriodType>
        <WeekDayOption>127</WeekDayOption>
        <Iteration>0</Iteration>
        <IterationType>0</IterationType>
        <ProcessTime>0</ProcessTime>
        <StepMemberList>
          <StepMember id="1" type="0" name="Main">
            <ComponentList>
              <Component id="1">
                <X>179.8065</X>
                <Y>76.38</Y>
                <Width>100</Width>
                <Height>40</Height>
                <Text>START</Text>
                <ComponentID>새시나리오_Main_EndPoint_1</ComponentID>
                <Property type="3">
                  <isBegin>1</isBegin>
                </Property>
              </Component>
              <Component id="2">
                <X>1024.511</X>
                <Y>2201.515</Y>
                <Width>100</Width>
                <Height>40</Height>
                <Text>END</Text>
                <ComponentID>새시나리오_Main_EndPoint_2</ComponentID>
                <Property type="3">
                  <isBegin>0</isBegin>
                </Property>
              </Component>
              <Component id="3">
                <X>129.8065</X>
                <Y>312.3998</Y>
                <Width>200</Width>
                <Height>85</Height>
                <Text>정태형 인가?</Text>
                <ComponentID>새시나리오_Main_Decision_1</ComponentID>
                <Property type="1">
                  <UserData name="expr" value="(CL)==0">(CL)==0</UserData>
                </Property>
              </Component>
              <Component id="4">
                <X>129.8065</X>
                <Y>175.3067</Y>
                <Width>200</Width>
                <Height>82</Height>
                <Text>범죄 가능성 = 0</Text>
                <ComponentID>새시나리오_Main_Process_2</ComponentID>
                <Property type="0">
                  <TeamList>
                  </TeamList>
                  <ProcessTime>0</ProcessTime>
                  <ProcessTimeType>5</ProcessTimeType>
                  <useProcessTime>0</useProcessTime>
                  <useMissionMessage>0</useMissionMessage>
                  <MissionList>
                  </MissionList>
                  <UserData name="expr" value="(CR)=0">(CR)=0</UserData>
                  <UserData name="showExpr" value="False">False</UserData>
                </Property>
              </Component>
              <Component id="5">
                <X>129.8065</X>
                <Y>472.1197</Y>
                <Width>200</Width>
                <Height>82</Height>
                <Text>정태형 범죄 가능성 산정</Text>
                <ComponentID>새시나리오_Main_Process_3</ComponentID>
                <Property type="0">
                  <TeamList>
                  </TeamList>
                  <ProcessTime>0</ProcessTime>
                  <ProcessTimeType>5</ProcessTimeType>
                  <useProcessTime>0</useProcessTime>
                  <useMissionMessage>0</useMissionMessage>
                  <MissionList>
                  </MissionList>
                  <UserData name="expr" value="(CR)=(CR)+(15*3)">(CR)=(CR)+(15*3)</UserData>
                  <UserData name="showExpr" value="False">False</UserData>
                </Property>
              </Component>
              <Component id="6">
                <X>891.5511</X>
                <Y>312.3998</Y>
                <Width>200</Width>
                <Height>85</Height>
                <Text>접근금지구역인가?</Text>
                <ComponentID>새시나리오_Main_Decision_2</ComponentID>
                <Property type="1">
                  <UserData name="expr" value="(CL)==3">(CL)==3</UserData>
                </Property>
              </Component>
              <Component id="7">
                <X>891.5511</X>
                <Y>470.4417</Y>
                <Width>200</Width>
                <Height>82</Height>
                <Text>접근금지구역 범죄 가능성 산정</Text>
                <ComponentID>새시나리오_Main_Process_4</ComponentID>
                <Property type="0">
                  <TeamList>
                  </TeamList>
                  <ProcessTime>0</ProcessTime>
                  <ProcessTimeType>5</ProcessTimeType>
                  <useProcessTime>0</useProcessTime>
                  <useMissionMessage>0</useMissionMessage>
                  <MissionList>
                  </MissionList>
                  <UserData name="expr" value="(CR)=(CR)+(60*2.5)">(CR)=(CR)+(60*2.5)</UserData>
                  <UserData name="showExpr" value="False">False</UserData>
                </Property>
              </Component>
              <Component id="8">
                <X>1377.899</X>
                <Y>461.0199</Y>
                <Width>200</Width>
                <Height>82</Height>
                <Text>기타 구역 범죄 가능성 산정</Text>
                <ComponentID>새시나리오_Main_Process_5</ComponentID>
                <Property type="0">
                  <TeamList>
                  </TeamList>
                  <ProcessTime>0</ProcessTime>
                  <ProcessTimeType>5</ProcessTimeType>
                  <useProcessTime>0</useProcessTime>
                  <useMissionMessage>0</useMissionMessage>
                  <MissionList>
                  </MissionList>
                  <UserData name="expr" value="(CR)=(CR)+(85*3)&#xD;&#xA;">(CR)=(CR)+(85*3)
</UserData>
                  <UserData name="showExpr" value="False">False</UserData>
                </Property>
              </Component>
              <Component id="9">
                <X>129.8065</X>
                <Y>603.4637</Y>
                <Width>200</Width>
                <Height>85</Height>
                <Text>고위험대시간인가?</Text>
                <ComponentID>새시나리오_Main_Decision_3</ComponentID>
                <Property type="1">
                  <UserData name="expr" value="((CHOUR)&gt;=12 &amp;&amp; (CHOUR) &lt; 18) || ((CHOUR) &gt;=20 &amp;&amp; (CHOUR) &lt;24) || ((CHOUR)&gt;=0 &amp;&amp; (CHOUR) &lt; 4)">((CHOUR)&gt;=12 &amp;&amp; (CHOUR) &lt; 18) || ((CHOUR) &gt;=20 &amp;&amp; (CHOUR) &lt;24) || ((CHOUR)&gt;=0 &amp;&amp; (CHOUR) &lt; 4)</UserData>
                </Property>
              </Component>
              <Component id="10">
                <X>369.0274</X>
                <Y>681.4637</Y>
                <Width>200</Width>
                <Height>85</Height>
                <Text>중위험대 시간인가?</Text>
                <ComponentID>새시나리오_Main_Decision_4</ComponentID>
                <Property type="1">
                  <UserData name="expr" value="((CHOUR)&gt;=9 &amp;&amp; (CHOUR) &lt; 12) || ((CHOUR) &gt;=18 &amp;&amp; (CHOUR) &lt;20)">((CHOUR)&gt;=9 &amp;&amp; (CHOUR) &lt; 12) || ((CHOUR) &gt;=18 &amp;&amp; (CHOUR) &lt;20)</UserData>
                </Property>
              </Component>
              <Component id="11">
                <X>129.8065</X>
                <Y>827.4637</Y>
                <Width>200</Width>
                <Height>82</Height>
                <Text>고위험대 시간 범죄 가능성 산정</Text>
                <ComponentID>새시나리오_Main_Process_6</ComponentID>
                <Property type="0">
                  <TeamList>
                  </TeamList>
                  <ProcessTime>0</ProcessTime>
                  <ProcessTimeType>5</ProcessTimeType>
                  <useProcessTime>0</useProcessTime>
                  <useMissionMessage>0</useMissionMessage>
                  <MissionList>
                  </MissionList>
                  <UserData name="expr" value="(CR)=(CR)+(70*3)">(CR)=(CR)+(70*3)</UserData>
                  <UserData name="showExpr" value="False">False</UserData>
                </Property>
              </Component>
              <Component id="12">
                <X>369.0274</X>
                <Y>825</Y>
                <Width>200</Width>
                <Height>82</Height>
                <Text>중위험대 시간 범죄 가능성 산정</Text>
                <ComponentID>새시나리오_Main_Process_7</ComponentID>
                <Property type="0">
                  <TeamList>
                  </TeamList>
                  <ProcessTime>0</ProcessTime>
                  <ProcessTimeType>5</ProcessTimeType>
                  <useProcessTime>0</useProcessTime>
                  <useMissionMessage>0</useMissionMessage>
                  <MissionList>
                  </MissionList>
                  <UserData name="expr" value="(CR)=(CR)+(25*3)">(CR)=(CR)+(25*3)</UserData>
                  <UserData name="showExpr" value="False">False</UserData>
                </Property>
              </Component>
              <Component id="13">
                <X>603</X>
                <Y>825.5164</Y>
                <Width>200</Width>
                <Height>82</Height>
                <Text>저위험대 시간 범죄 가능성 산정</Text>
                <ComponentID>새시나리오_Main_Process_8</ComponentID>
                <Property type="0">
                  <TeamList>
                  </TeamList>
                  <ProcessTime>0</ProcessTime>
                  <ProcessTimeType>5</ProcessTimeType>
                  <useProcessTime>0</useProcessTime>
                  <useMissionMessage>0</useMissionMessage>
                  <MissionList>
                  </MissionList>
                  <UserData name="expr" value="(CR)=(CR)+(5*3)">(CR)=(CR)+(5*3)</UserData>
                  <UserData name="showExpr" value="False">False</UserData>
                </Property>
              </Component>
              <Component id="14">
                <X>129.8065</X>
                <Y>992.7852</Y>